{
  "status": "ok",
  "batch_size": 50,
  "inserted": 50,
  "duplicates": 0,
  "upserted": 0,
  "rejected": [],
  "observation_ids": [
    "https://elian0609.github.io/sensado-vehicular/id/obs/ppd42ns_01/low_pulse_occupancy_ratio/20261008T161739Z",
    "https://elian0609.github.io/sensado-vehicular/id/obs/ppd42ns_01/low_pulse_occupancy_ratio/20261008T161809Z",
    "https://elian0609.github.io/sensado-vehicular/id/obs/ppd42ns_01/low_pulse_occupancy_ratio/20261008T161839Z",
    "https://elian0609.github.io/sensado-vehicular/id/obs/ppd42ns_01/low_pulse_occupancy_ratio/20261008T161909Z",
    "https://elian0609.github.io/sensado-vehicular/id/obs/ppd42ns_01/low_pulse_occupancy_ratio/20261008T161939Z",
    "https://elian0609.github.io/sensado-vehicular/id/obs/ppd42ns_01/low_pulse_occupancy_ratio/20261008T162009Z",
    "https://elian0609.github.io/sensado-vehicular/id/obs/ppd42ns_01/low_pulse_occupancy_ratio/20261008T162039Z",
    "https://elian0609.github.io/sensado-vehicular/id/obs/ppd42ns_01/low_pulse_occupancy_ratio/20261008T162109Z",
    "https://elian0609.github.io/sensado-vehicular/id/obs/ppd42ns_01/low_pulse_occupancy_ratio/20261008T162139Z",
    "https://elian0609.github.io/sensado-vehicular/id/obs/ppd42ns_01/low_pulse_occupancy_ratio/20261008T162209Z",
    "https://elian0609.github.io/sensado-vehicular/id/obs/ppd42ns_01/low_pulse_occupancy_ratio/20261008T162239Z",
    "https://elian0609.github.io/sensado-vehicular/id/obs/ppd42ns_01/low_pulse_occupancy_ratio/20261008T162309Z",
    "https://elian0609.github.io/sensado-vehicular/id/obs/ppd42ns_01/low_pulse_occupancy_ratio/20261008T162339Z",
    "https://elian0609.github.io/sensado-vehicular/id/obs/ppd42ns_01/low_pulse_occupancy_ratio/20261008T162409Z",
    "https://elian0609.github.io/sensado-vehicular/id/obs/ppd42ns_01/low_pulse_occupancy_ratio/20261008T162439Z",
    "https://elian0609.github.io/sensado-vehicular/id/obs/ppd42ns_01/low_pulse_occupancy_ratio/20261008T162509Z",
    "https://elian0609.github.io/sensado-vehicular/id/obs/ppd42ns_01/low_pulse_occupancy_ratio/20261008T162539Z",
    "https://elian0609.github.io/sensado-vehicular/id/obs/ppd42ns_01/low_pulse_occupancy_ratio/20261008T162609Z",
    "https://elian0609.github.io/sensado-vehicular/id/obs/ppd42ns_01/low_pulse_occupancy_ratio/20261008T162639Z",
    "https://elian0609.github.io/sensado-vehicular/id/obs/ppd42ns_01/low_pulse_occupancy_ratio/20261008T162709Z",
    "https://elian0609.github.io/sensado-vehicular/id/obs/ppd42ns_01/low_pulse_occupancy_ratio/20261008T162739Z",
    "https://elian0609.github.io/sensado-vehicular/id/obs/ppd42ns_01/low_pulse_occupancy_ratio/20261008T162809Z",
    "https://elian0609.github.io/sensado-vehicular/id/obs/ppd42ns_01/low_pulse_occupancy_ratio/20261008T162839Z",
    "https://elian0609.github.io/sensado-vehicular/id/obs/ppd42ns_01/low_pulse_occupancy_ratio/20261008T162909Z",
    "https://elian0609.github.io/sensado-vehicular/id/obs/ppd42ns_01/low_pulse_occupancy_ratio/20261008T162939Z",
    "https://elian0609.github.io/sensado-vehicular/id/obs/ppd42ns_01/low_pulse_occupancy_ratio/20261008T163009Z",
    "https://elian0609.github.io/sensado-vehicular/id/obs/ppd42ns_01/low_pulse_occupancy_ratio/20261008T163039Z",
    "https://elian0609.github.io/sensado-vehicular/id/obs/ppd42ns_01/low_pulse_occupancy_ratio/20261008T163109Z",
    "https://elian0609.github.io/sensado-vehicular/id/obs/ppd42ns_01/low_pulse_occupancy_ratio/20261008T163139Z",
    "https://elian0609.github.io/sensado-vehicular/id/obs/ppd42ns_01/low_pulse_occupancy_ratio/20261008T163209Z",
    "https://elian0609.github.io/sensado-vehicular/id/obs/ppd42ns_01/low_pulse_occupancy_ratio/20261008T163239Z",
    "https://elian0609.github.io/sensado-vehicular/id/obs/ppd42ns_01/low_pulse_occupancy_ratio/20261008T163309Z",
    "https://elian0609.github.io/sensado-vehicular/id/obs/ppd42ns_01/low_pulse_occupancy_ratio/20261008T163339Z",
    "https://elian0609.github.io/sensado-vehicular/id/obs/ppd42ns_01/low_pulse_occupancy_ratio/20261008T163409Z",
    "https://elian0609.github.io/sensado-vehicular/id/obs/ppd42ns_01/low_pulse_occupancy_ratio/20261008T163439Z",
    "https://elian0609.github.io/sensado-vehicular/id/obs/ppd42ns_01/low_pulse_occupancy_ratio/20261008T163509Z",
    "https://elian0609.github.io/sensado-vehicular/id/obs/ppd42ns_01/low_pulse_occupancy_ratio/20261008T163539Z",
    "https://elian0609.github.io/sensado-vehicular/id/obs/ppd42ns_01/low_pulse_occupancy_ratio/20261008T163609Z",
    "https://elian0609.github.io/sensado-vehicular/id/obs/ppd42ns_01/low_pulse_occupancy_ratio/20261008T163639Z",
    "https://elian0609.github.io/sensado-vehicular/id/obs/ppd42ns_01/low_pulse_occupancy_ratio/20261008T163709Z",
    "https://elian0609.github.io/sensado-vehicular/id/obs/ppd42ns_01/low_pulse_occupancy_ratio/20261008T163739Z",
    "https://elian0609.github.io/sensado-vehicular/id/obs/ppd42ns_01/low_pulse_occupancy_ratio/20261008T163809Z",
    "https://elian0609.github.io/sensado-vehicular/id/obs/ppd42ns_01/low_pulse_occupancy_ratio/20261008T163839Z",
    "https://elian0609.github.io/sensado-vehicular/id/obs/ppd42ns_01/low_pulse_occupancy_ratio/20261008T163909Z",
    "https://elian0609.github.io/sensado-vehicular/id/obs/ppd42ns_01/low_pulse_occupancy_ratio/20261008T163939Z",
    "https://elian0609.github.io/sensado-vehicular/id/obs/ppd42ns_01/low_pulse_occupancy_ratio/20261008T164009Z",
    "https://elian0609.github.io/sensado-vehicular/id/obs/ppd42ns_01/low_pulse_occupancy_ratio/20261008T164039Z",
    "https://elian0609.github.io/sensado-vehicular/id/obs/ppd42ns_01/low_pulse_occupancy_ratio/20261008T164109Z",
    "https://elian0609.github.io/sensado-vehicular/id/obs/ppd42ns_01/low_pulse_occupancy_ratio/20261008T164139Z",
    "https://elian0609.github.io/sensado-vehicular/id/obs/ppd42ns_01/low_pulse_occupancy_ratio/20261008T164209Z"
  ]
}
